"list_og","list_sort","N","cor_pos","target_letter","rewMag","Ndist","editDistance","N_filler","effort_q"
"Q O M","MOQ",3,3,"Q","85 pts",1,2,0,0
"F H J L N T P R V","FHJLNPRTV",9,2,"H","30 pts",1,2,0,1
"F N J L H P R","FHJLNPR",7,7,"R","47 pts",1,2,0,1
"G I S K M O Q U W","GIKMOQSUW",9,6,"Q","27 pts",1,2,0,0
"J H L P N R T V","HJLNPRTV",8,1,"H","71 pts",1,2,0,0
"U M O Q S","MOQSU",5,2,"O","50 pts",1,2,0,0
"H L N P R T J V","HJLNPRTV",8,5,"P","39 pts",1,2,0,0
"I G E","EGI",3,2,"G","67 pts",1,2,0,0
"J L N H P","HJLNP",5,2,"J","75 pts",1,2,0,1
"I K M O G Q","GIKMOQ",6,4,"M","70 pts",1,2,0,1
"M O Q S K U","KMOQSU",6,4,"Q","89 pts",1,2,0,0
"D H J F L","DFHJL",5,4,"J","51 pts",1,2,0,1
"O K M Q","KMOQ",4,1,"K","20 pts",1,2,0,1
"D F N H J L","DFHJLN",6,3,"H","51 pts",1,2,0,1
"G M K I O Q S","GIKMOQS",7,4,"M","22 pts",1,2,0,1
"N F H J L","FHJLN",5,1,"F","11 pts",1,2,0,1
"K G I E M O Q S","EGIKMOQS",8,1,"E","46 pts",1,2,0,1
"P N L","LNP",3,1,"L","49 pts",1,2,0,1
"H F L J N P","FHJLNP",6,1,"F","52 pts",1,2,0,1
"O E G I K M Q S U","EGIKMOQSU",9,3,"I","16 pts",1,2,0,0
"Q S U O","OQSU",4,3,"S","71 pts",1,2,0,1
"N P R L","LNPR",4,2,"N","76 pts",1,2,0,0
"J N P L R","JLNPR",5,3,"N","56 pts",1,2,0,0
"Q M O","MOQ",3,3,"Q","46 pts",1,2,0,1
"F J L H N P R T","FHJLNPRT",8,6,"P","18 pts",1,2,0,0
"D P H J L N F R","DFHJLNPR",8,6,"N","56 pts",1,2,0,1
"E G K M O Q S I U","EGIKMOQSU",9,8,"S","29 pts",1,2,0,0
"R P N","NPR",3,1,"N","24 pts",1,2,0,1
"G I K M Q S O U W","GIKMOQSUW",9,1,"G","13 pts",1,2,0,1
"K G I","GIK",3,2,"I","47 pts",1,2,0,1
"H F J L N R P","FHJLNPR",7,2,"H","28 pts",1,2,0,1
"K M Q O U S","KMOQSU",6,2,"M","66 pts",1,2,0,0
"H D F","DFH",3,1,"D","70 pts",1,2,0,1
"E I G M K O Q","EGIKMOQ",7,2,"G","48 pts",1,2,0,0
"G I K O M S Q","GIKMOQS",7,3,"K","19 pts",1,2,0,1
"D F H J R N P L","DFHJLNPR",8,4,"J","79 pts",1,2,0,0
"J L H","HJL",3,3,"L","21 pts",1,2,0,0
"P J L N H","HJLNP",5,4,"N","47 pts",1,2,0,1
"F J L N H P R T V","FHJLNPRTV",9,7,"R","25 pts",1,2,0,0
"I Q M O K S","IKMOQS",6,2,"K","18 pts",1,2,0,1
"U Q S O","OQSU",4,4,"U","13 pts",1,2,0,0
"G S K M O Q I U W","GIKMOQSUW",9,9,"W","71 pts",1,2,0,1
"I G M K O Q S U","GIKMOQSU",8,4,"M","76 pts",1,2,0,1
"H F L J","FHJL",4,3,"J","37 pts",1,2,0,0
"H L N P R J T V","HJLNPRTV",8,7,"T","13 pts",1,2,0,1
"L P N T R","LNPRT",5,2,"N","72 pts",1,2,0,0
"I K U O Q S M","IKMOQSU",7,4,"O","62 pts",1,2,0,0
"N J L","JLN",3,3,"N","13 pts",1,2,0,1
"G I Q M O K S U W","GIKMOQSUW",9,2,"I","64 pts",1,2,0,1
"Q I K M O","IKMOQ",5,3,"M","73 pts",1,2,0,0
"J F H L","FHJL",4,3,"J","32 pts",1,2,0,0
"T N P R","NPRT",4,2,"P","89 pts",1,2,0,1
"H J N P R L","HJLNPR",6,5,"P","59 pts",1,2,0,1
"E I G K O M Q","EGIKMOQ",7,6,"O","85 pts",1,2,0,1
"R F H J L N P D","DFHJLNPR",8,2,"F","61 pts",1,2,0,1
"D F J L H N P R T","DFHJLNPRT",9,7,"P","89 pts",1,2,0,0
"J P L N R T","JLNPRT",6,6,"T","33 pts",1,2,0,1
"D F H J L P R N","DFHJLNPR",8,5,"L","87 pts",1,2,0,0
"F J H L P N R","FHJLNPR",7,7,"R","90 pts",1,2,0,0
"P R N","NPR",3,3,"R","32 pts",1,2,0,0
"E I K M G","EGIKM",5,2,"G","61 pts",1,2,0,0
"G I O M K Q S","GIKMOQS",7,5,"O","37 pts",1,2,0,1
"M I K G O Q","GIKMOQ",6,1,"G","17 pts",1,2,0,0
"F D H J L N R P","DFHJLNPR",8,3,"H","47 pts",1,2,0,0
"G K I M O Q U S","GIKMOQSU",8,6,"Q","70 pts",1,2,0,0
"H J F L N","FHJLN",5,4,"L","62 pts",1,2,0,1
"M Q O U S","MOQSU",5,1,"M","34 pts",1,2,0,0
"I M K O Q U S W","IKMOQSUW",8,8,"W","75 pts",1,2,0,0
"F H J L N P D","DFHJLNP",7,5,"L","31 pts",1,2,0,0
"N L J","JLN",3,3,"N","11 pts",1,2,0,1
"L R N P","LNPR",4,3,"P","56 pts",1,2,0,1
"D H F J L N R P","DFHJLNPR",8,2,"F","33 pts",1,2,0,1
"I O M K","IKMO",4,3,"M","69 pts",1,2,0,0
"K M I","IKM",3,2,"K","14 pts",1,2,0,0
"M S Q O U","MOQSU",5,2,"O","18 pts",1,2,0,1
"I E G","EGI",3,3,"I","27 pts",1,2,0,1
"M K I","IKM",3,1,"I","10 pts",1,2,0,1
"D F H L N J P R T","DFHJLNPRT",9,7,"P","37 pts",1,2,0,1
"H L N J P","HJLNP",5,2,"J","57 pts",1,2,0,1
"G E I K O M Q","EGIKMOQ",7,4,"K","23 pts",1,2,0,0
"K I M Q O S U","IKMOQSU",7,7,"U","80 pts",1,2,0,0
"O Q S M U W","MOQSUW",6,1,"M","22 pts",1,2,0,0
"F D H J N L P R","DFHJLNPR",8,7,"P","40 pts",1,2,0,1
"I K G","GIK",3,3,"K","25 pts",1,2,0,1
"G I O M K","GIKMO",5,1,"G","49 pts",1,2,0,1
"F H R J L N P T","FHJLNPRT",8,5,"N","78 pts",1,2,0,1
"G I M K Q O S U W","GIKMOQSUW",9,6,"Q","66 pts",1,2,0,1
"E K I G","EGIK",4,3,"I","63 pts",1,2,0,1
"D F N H J L P","DFHJLNP",7,4,"J","42 pts",1,2,0,1
"I E G K","EGIK",4,1,"E","61 pts",1,2,0,0
"F H L N P R T J","FHJLNPRT",8,2,"H","27 pts",1,2,0,0
"T N P R L V","LNPRTV",6,5,"T","46 pts",1,2,0,0
"L P N T R V","LNPRTV",6,4,"R","16 pts",1,2,0,1
"G I O K M","GIKMO",5,2,"I","25 pts",1,2,0,1
"I O M K Q","IKMOQ",5,4,"O","69 pts",1,2,0,0
"K G I M O","GIKMO",5,5,"O","64 pts",1,2,0,0
"U S Q","QSU",3,2,"S","28 pts",1,2,0,1
"H J L N P F R T","FHJLNPRT",8,7,"R","55 pts",1,2,0,1
"E I K M O G Q","EGIKMOQ",7,4,"K","76 pts",1,2,0,0
"F H J V N P R T L","FHJLNPRTV",9,6,"P","74 pts",1,2,0,0
"F H J L N P D R T","DFHJLNPRT",9,4,"J","49 pts",1,2,0,1
"E G M I K O Q S U","EGIKMOQSU",9,6,"O","48 pts",1,2,0,0
"G I K M W O Q S U","GIKMOQSUW",9,1,"G","76 pts",1,2,0,1
"M K Q O","KMOQ",4,4,"Q","86 pts",1,2,0,1
"M G I K E O Q S","EGIKMOQS",8,7,"Q","64 pts",1,2,0,0
"J F H","FHJ",3,2,"H","63 pts",1,2,0,0
"I K M O Q G S U W","GIKMOQSUW",9,4,"M","35 pts",1,2,0,0
"O I K M G Q","GIKMOQ",6,5,"O","38 pts",1,2,0,0
"M G I K","GIKM",4,1,"G","62 pts",1,2,0,1
"H F J L N R P T","FHJLNPRT",8,2,"H","67 pts",1,2,0,1
"H J P N L","HJLNP",5,5,"P","36 pts",1,2,0,1
"L P N R V T","LNPRTV",6,5,"T","88 pts",1,2,0,1
"M K I O","IKMO",4,4,"O","55 pts",1,2,0,0
"Q O M S U W","MOQSUW",6,5,"U","36 pts",1,2,0,0
"J P N L R T","JLNPRT",6,5,"R","75 pts",1,2,0,0
"G I M O K","GIKMO",5,4,"M","85 pts",1,2,0,1
"H F J L P N R T V","FHJLNPRTV",9,6,"P","36 pts",1,2,0,0
"O U S Q","OQSU",4,3,"S","65 pts",1,2,0,1
"J L P R T N","JLNPRT",6,6,"T","32 pts",1,2,0,1
"F P J L N H","FHJLNP",6,1,"F","73 pts",1,2,0,1
"H J N L R P T","HJLNPRT",7,1,"H","17 pts",1,2,0,1
"V H J L N P R T","HJLNPRTV",8,6,"R","65 pts",1,2,0,1
"M O K","KMO",3,2,"M","62 pts",1,2,0,0
"R T P","PRT",3,1,"P","52 pts",1,2,0,0
"H F L J N","FHJLN",5,3,"J","16 pts",1,2,0,0
"J H F","FHJ",3,1,"F","38 pts",1,2,0,0
"F H J L P R N","FHJLNPR",7,3,"J","27 pts",1,2,0,0
"M S O Q U","MOQSU",5,5,"U","27 pts",1,2,0,1
"U K M O Q S W","KMOQSUW",7,7,"W","56 pts",1,2,0,1
"T P R","PRT",3,1,"P","42 pts",1,2,0,0
"H J L N F P R T","FHJLNPRT",8,7,"R","45 pts",1,2,0,0
"E I K M G O Q S U","EGIKMOQSU",9,5,"M","14 pts",1,2,0,0
"Q S O U","OQSU",4,2,"Q","66 pts",1,2,0,0
"H L N P J","HJLNP",5,3,"L","76 pts",1,2,0,0
"O Q M","MOQ",3,3,"Q","56 pts",1,2,0,0
"K M Q S U O","KMOQSU",6,6,"U","68 pts",1,2,0,1
"E I G K M Q O S","EGIKMOQS",8,8,"S","44 pts",1,2,0,0
"E G K I M O Q U S","EGIKMOQSU",9,9,"U","78 pts",1,2,0,1
"I K M S Q O","IKMOQS",6,4,"O","44 pts",1,2,0,1
"K I O M Q","IKMOQ",5,2,"K","20 pts",1,2,0,0
"L H J F N P R","FHJLNPR",7,1,"F","53 pts",1,2,0,0
"G K I M Q O","GIKMOQ",6,4,"M","63 pts",1,2,0,0
"T R P","PRT",3,2,"R","54 pts",1,2,0,1
"H J R N P L","HJLNPR",6,2,"J","85 pts",1,2,0,0
"J H L N R P T V","HJLNPRTV",8,7,"T","59 pts",1,2,0,1
"E I K M G O Q","EGIKMOQ",7,1,"E","14 pts",1,2,0,1
"L H J N","HJLN",4,1,"H","22 pts",1,2,0,0
"H L J P N R T","HJLNPRT",7,6,"R","65 pts",1,2,0,0
"F H J L N D P R T","DFHJLNPRT",9,4,"J","45 pts",1,2,0,0
"I G E K","EGIK",4,2,"G","81 pts",1,2,0,1
"D F H P L N J","DFHJLNP",7,3,"H","15 pts",1,2,0,0
"Q M O K","KMOQ",4,2,"M","36 pts",1,2,0,1
"S K M O Q","KMOQS",5,1,"K","41 pts",1,2,0,0
"I G M K O Q S U W","GIKMOQSUW",9,6,"Q","51 pts",1,2,0,1
"F J L N P H R T V","FHJLNPRTV",9,1,"F","28 pts",1,2,0,1
"J N P R T L V","JLNPRTV",7,1,"J","63 pts",1,2,0,1
"R P N T","NPRT",4,3,"R","48 pts",1,2,0,0
"M Q S O","MOQS",4,1,"M","58 pts",1,2,0,1
"U O Q S","OQSU",4,4,"U","11 pts",1,2,0,0
"G K M O I Q","GIKMOQ",6,4,"M","13 pts",1,2,0,0
"D J F H L N P R T","DFHJLNPRT",9,4,"J","83 pts",1,2,0,1
"I G M K","GIKM",4,2,"I","54 pts",1,2,0,0
"I K G M O Q S U W","GIKMOQSUW",9,6,"Q","58 pts",1,2,0,0
"G I E K","EGIK",4,4,"K","59 pts",1,2,0,1
"N D F H J L","DFHJLN",6,6,"N","41 pts",1,2,0,0
"J H L P N R T","HJLNPRT",7,4,"N","38 pts",1,2,0,1
"J L R P N T V","JLNPRTV",7,1,"J","72 pts",1,2,0,0
"O K M","KMO",3,2,"M","34 pts",1,2,0,0
